{
  "findings": [
    {
      "category": "statistical_validity",
      "code": "IC_DEFINED",
      "evidence": {
        "mean_ic": 0.04,
        "rule_version": 1,
        "weight": 12.0
      },
      "message": "The IC time series contains a defined aggregate correlation.",
      "severity": "high",
      "state": "PASS",
      "title": "Information coefficient is defined"
    },
    {
      "category": "experiment_integrity",
      "code": "TRIAL_HISTORY_AVAILABLE",
      "evidence": {
        "rule_version": 1,
        "weight": 2.0
      },
      "message": "experiment trial history was not supplied",
      "severity": "high",
      "state": "UNKNOWN",
      "title": "Research trial history is available"
    }
  ],
  "metadata": {
    "created_at": "2026-08-26T12:00:00Z",
    "input_fingerprint": "sha256:fixture-v1",
    "method": "audit.v0_1",
    "method_version": 1,
    "parameters": {
      "not_applicable_policy": "excluded",
      "score_version": 1,
      "unknown_credit": 0.0,
      "warn_credit": 0.5
    },
    "seed": 42
  },
  "metrics": {
    "earned_weight": 80.0,
    "evidence_coverage": 0.8,
    "failure_count": 0,
    "finding_count": 2,
    "not_applicable_count": 0,
    "possible_weight": 100.0,
    "robustness_score": 80.0,
    "unknown_count": 1,
    "unknown_weight": 20.0,
    "warning_count": 0
  },
  "schema_version": "1",
  "tables": {
    "finding_summary": [
      {
        "count": 1,
        "state": "PASS"
      },
      {
        "count": 1,
        "state": "UNKNOWN"
      }
    ],
    "score_components": [
      {
        "category": "statistical_validity",
        "earned_weight": 80.0,
        "possible_weight": 100.0,
        "score": 80.0,
        "unknown_weight": 20.0
      }
    ]
  },
  "warnings": [
    "Representative compatibility fixture; values are illustrative."
  ]
}
